{
  "$schema": "https://json-schema.org/draft/2020-12/schema",
  "$id": "feed.schema.json",
  "title": "Feed",
  "description": "Blueprint 6.6. content/packs/{pack}/feed.json. Exactly one hero per pack and the ppn-panic via_dissect flag are check 10, not schema.",
  "type": "object",
  "additionalProperties": false,
  "required": ["pack", "updated_at", "items"],
  "properties": {
    "seed": {
      "const": true,
      "description": "Quarantine flag on transcribed seed fixtures (Gate 2). Optional, true only, and absent from every artifact in content/: check 7 (slug seed) is this field's validator coverage and fails any content root that carries it. The root stays closed otherwise.",
      "type": "boolean"
    },
    "pack": { "enum": ["id", "en"] },
    "updated_at": { "type": "string", "minLength": 1 },
    "items": {
      "type": "array",
      "items": {
        "type": "object",
        "additionalProperties": false,
        "required": ["narrative_id", "slot"],
        "properties": {
          "narrative_id": { "type": "string", "minLength": 1 },
          "slot": { "enum": ["hero", "compact"] },
          "via_dissect": { "type": "boolean" },
          "crisis_hold": { "type": "boolean" }
        }
      }
    }
  }
}
